{
  "schemaVersion": 1,
  "id": "aiv-note-gen-1-1-3-001",
  "kind": "aiv-note",
  "label": "Kevin's comment (not Scripture)",
  "author": {
    "name": "Kevin Amundson",
    "role": "interpreter"
  },
  "status": "draft-for-kevin",
  "visibility": "private",
  "createdAt": "2026-09-14T03:15:00Z",
  "updatedAt": "2026-09-14T03:15:00Z",
  "range": {
    "start": {
      "book": "GEN",
      "chapter": 1,
      "verse": 1
    },
    "end": {
      "book": "GEN",
      "chapter": 1,
      "verse": 3
    }
  },
  "verseIds": [
    "GEN.1.1",
    "GEN.1.2",
    "GEN.1.3"
  ],
  "body": {
    "format": "markdown",
    "text": "DRAFT-FOR-KEVIN: Creation week opens with God speaking light into being. See also [[GEN.1.1]]. **Not** Scripture \u2014 placeholder for M2 range + rich body."
  },
  "tags": [
    "creation",
    "draft",
    "m2-range"
  ],
  "revisions": [
    {
      "at": "2026-09-14T03:15:00Z",
      "summary": "M2 example: inclusive GEN 1:1\u20133 verseIds + wiki scripture ref in body.",
      "by": "Baruch"
    }
  ]
}
